{
  "$schema": "../../../oracle-fixture.schema.json",
  "capture_kind": "accepted-runtime-outcomes",
  "cases": [
    {
      "assertions": {
        "machine_paths_normalized": true,
        "secret_absent": true
      },
      "coverage": [
        "provider-normalization"
      ],
      "disposition": "captured",
      "id": "node.crossref-normalization",
      "invocation": {
        "arguments": {
          "fixture": "content/mcp-contracts/fixtures/crossref-search-response.json",
          "limit": 1,
          "network": false,
          "query": "runtime baseline"
        },
        "operation": "searchCrossref with canonical mocked response",
        "transport": "module-fixture-driver"
      },
      "kind": "provider-normalization-outcome",
      "outcome": {
        "error": null,
        "exit_code": 0,
        "status": "success",
        "value": {
          "result": {
            "attempts": 1,
            "error": null,
            "provider": "crossref",
            "request_count": 1,
            "results": [
              {
                "abstract": null,
                "access_url": null,
                "authors": [],
                "citation_count": null,
                "citations": [],
                "document_type": null,
                "doi": "10.1234/example",
                "evidence_limit": null,
                "fulltext_status": null,
                "license": null,
                "local_zotero_match": null,
                "open_access_pdf_url": null,
                "provider": "crossref",
                "reference_count": null,
                "references": [],
                "review_status": null,
                "source_id": "10.1234/example",
                "source_type": null,
                "title": "A Test Paper",
                "url": null,
                "venue": "Journal of Tests",
                "verification": null,
                "year": 2025,
                "zotero": null
              }
            ]
          },
          "stderr_lines": []
        }
      },
      "side_effects": {
        "class": "none",
        "filesystem_delta": {
          "after_tree_sha256": "4f53cda18c2baa0c0354bb5f9a3ecbe5ed12ab4d8e11ba873c2f11161202b945",
          "before_tree_sha256": "4f53cda18c2baa0c0354bb5f9a3ecbe5ed12ab4d8e11ba873c2f11161202b945",
          "created": [],
          "deleted": [],
          "modified": []
        },
        "writes_outside_sandbox": false
      },
      "source_paths": [
        "packages/qiongli-literature-mcpb/server/providers/crossref.mjs",
        "packages/qiongli-literature-mcpb/server/providers/http.mjs",
        "packages/qiongli-literature-mcpb/server/normalize.mjs",
        "content/mcp-contracts/fixtures/crossref-search-response.json"
      ]
    },
    {
      "assertions": {
        "machine_paths_normalized": true,
        "secret_absent": true
      },
      "coverage": [
        "malformed-config-fail-closed"
      ],
      "disposition": "captured",
      "id": "node.malformed-config-fail-closed",
      "invocation": {
        "arguments": {
          "config_fixture": "malformed-redacted-json"
        },
        "operation": "tools/call qiongli_config_status with malformed config",
        "transport": "jsonrpc-stdio"
      },
      "kind": "fail-closed-outcome",
      "outcome": {
        "error": {
          "code": -32603,
          "message": "provider configuration is unavailable"
        },
        "exit_code": 0,
        "status": "error",
        "value": {
          "config_preserved": true,
          "stderr_lines": []
        }
      },
      "side_effects": {
        "class": "none",
        "filesystem_delta": {
          "after_tree_sha256": "7c8f55fa0e78422e20dda2e6736e6152fcd8491012b0317aff39575cc0979b71",
          "before_tree_sha256": "7c8f55fa0e78422e20dda2e6736e6152fcd8491012b0317aff39575cc0979b71",
          "created": [],
          "deleted": [],
          "modified": []
        },
        "writes_outside_sandbox": false
      },
      "source_paths": [
        "packages/qiongli-literature-mcpb/server/config.mjs",
        "packages/qiongli-literature-mcpb/server/stdio.mjs"
      ]
    },
    {
      "assertions": {
        "machine_paths_normalized": true,
        "secret_absent": true
      },
      "coverage": [
        "mcp-initialize-and-list"
      ],
      "disposition": "captured",
      "id": "node.mcp-initialize-list",
      "invocation": {
        "arguments": {
          "protocol_version": "2024-11-05"
        },
        "operation": "initialize + tools/list",
        "transport": "jsonrpc-stdio"
      },
      "kind": "jsonrpc-outcome",
      "outcome": {
        "error": null,
        "exit_code": 0,
        "status": "success",
        "value": {
          "initialize": {
            "capabilities": {
              "tools": {}
            },
            "protocolVersion": "2024-11-05",
            "serverInfo": {
              "name": "qiongli-literature-provider",
              "version": "0.2.0-beta.3"
            }
          },
          "stderr_lines": [],
          "tool_count": 12,
          "tool_names": [
            "qiongli_literature_status",
            "qiongli_search_plan",
            "qiongli_config_status",
            "qiongli_configure_provider",
            "qiongli_save_provider_config",
            "qiongli_open_config_wizard",
            "qiongli_literature_search",
            "qiongli_literature_export_evidence",
            "qiongli_zotero_status",
            "qiongli_zotero_search",
            "qiongli_zotero_upsert_references",
            "qiongli_zotero_export_import_files"
          ]
        }
      },
      "side_effects": {
        "class": "none",
        "filesystem_delta": {
          "after_tree_sha256": "4f53cda18c2baa0c0354bb5f9a3ecbe5ed12ab4d8e11ba873c2f11161202b945",
          "before_tree_sha256": "4f53cda18c2baa0c0354bb5f9a3ecbe5ed12ab4d8e11ba873c2f11161202b945",
          "created": [],
          "deleted": [],
          "modified": []
        },
        "writes_outside_sandbox": false
      },
      "source_paths": [
        "packages/qiongli-literature-mcpb/server/index.mjs",
        "packages/qiongli-literature-mcpb/server/stdio.mjs"
      ]
    },
    {
      "assertions": {
        "machine_paths_normalized": true,
        "secret_absent": true
      },
      "coverage": [
        "search-plan"
      ],
      "disposition": "captured",
      "id": "node.search-plan",
      "invocation": {
        "arguments": {
          "native_search_available": true,
          "native_search_tools": [
            "codex_web_search"
          ],
          "platform": "codex",
          "query": "runtime oracle"
        },
        "operation": "tools/call qiongli_search_plan",
        "transport": "jsonrpc-stdio"
      },
      "kind": "search-plan-outcome",
      "outcome": {
        "error": null,
        "exit_code": 0,
        "status": "success",
        "value": {
          "plan": {
            "artifact_type": "qiongli_hybrid_search_plan",
            "limitations": [],
            "native_search_queries": [
              {
                "filters": {},
                "platform": "codex",
                "provenance_label": "native:codex_web_search",
                "query": "runtime oracle",
                "query_id": "Q1",
                "source": "primary",
                "tool": "codex_web_search"
              }
            ],
            "platform": "codex",
            "provider_capability_mode": "provider_connected",
            "provider_queries": [
              {
                "filters": {},
                "provenance_label": "mcp:arxiv",
                "provider": "arxiv",
                "query": "runtime oracle",
                "query_id": "Q1",
                "source": "primary"
              }
            ],
            "query": "runtime oracle",
            "search_execution_mode": "hybrid_search"
          },
          "stderr_lines": []
        }
      },
      "side_effects": {
        "class": "none",
        "filesystem_delta": {
          "after_tree_sha256": "4f53cda18c2baa0c0354bb5f9a3ecbe5ed12ab4d8e11ba873c2f11161202b945",
          "before_tree_sha256": "4f53cda18c2baa0c0354bb5f9a3ecbe5ed12ab4d8e11ba873c2f11161202b945",
          "created": [],
          "deleted": [],
          "modified": []
        },
        "writes_outside_sandbox": false
      },
      "source_paths": [
        "packages/qiongli-literature-mcpb/server/index.mjs",
        "packages/qiongli-literature-mcpb/server/search-plan.mjs"
      ]
    },
    {
      "assertions": {
        "machine_paths_normalized": true,
        "secret_absent": true
      },
      "coverage": [
        "unsupported-config-fail-closed"
      ],
      "disposition": "captured",
      "id": "node.unsupported-config-fail-closed",
      "invocation": {
        "arguments": {
          "config_home": "relative-config-home"
        },
        "operation": "tools/call qiongli_config_status with relative config home",
        "transport": "jsonrpc-stdio"
      },
      "kind": "fail-closed-outcome",
      "outcome": {
        "error": {
          "code": -32603,
          "message": "QIONGLI_CONFIG_HOME must be a fully qualified absolute path or use '~' home notation"
        },
        "exit_code": 0,
        "status": "error",
        "value": {
          "filesystem_unchanged": true,
          "stderr_lines": []
        }
      },
      "side_effects": {
        "class": "none",
        "filesystem_delta": {
          "after_tree_sha256": "4f53cda18c2baa0c0354bb5f9a3ecbe5ed12ab4d8e11ba873c2f11161202b945",
          "before_tree_sha256": "4f53cda18c2baa0c0354bb5f9a3ecbe5ed12ab4d8e11ba873c2f11161202b945",
          "created": [],
          "deleted": [],
          "modified": []
        },
        "writes_outside_sandbox": false
      },
      "source_paths": [
        "packages/qiongli-literature-mcpb/server/config.mjs",